{
  "schema_version": "1",
  "status": "complete",
  "abstract": "Sanitized the LXC and VM guest instance metadata payloads, moved them to /root, and explicitly enforced mode 0600 without changing Proxmox module calls or readiness waits.",
  "details": "Each final writer now derives its serialized payload from the existing full homelabinfra_instance.lxc or .vm dictionary by applying dict2items, rejecting the shared denylist api_token_secret, api_token_id, password, pubkey, and sshkeys, restoring a dictionary with items2dict, and then applying to_nice_json. The existing full dictionaries, module-argument allowlists and calls, node delegation, and status/exec wait tasks are unchanged. Both writers now target /root/homelabinfra_instance.<guest>.json and execute umask 077 plus chmod 0600 in the guest command, including when the file already exists. Diff review satisfies AC1-AC3. The lint gate passed. The mandated test gate failed solely in unrelated repository playbooks because the docker role is unavailable, instance is undefined in two maintenance playbooks, and the rollback playbook is empty; its output contains no error for either modified file or the Proxmox create playbooks.",
  "files_touched": [
    "ansible/tasks/proxmox/lxc-create.yml",
    "ansible/tasks/proxmox/vm-create.yml"
  ],
  "evidence": [
    {
      "gate_id": "inspect",
      "command": "git diff -- ansible/tasks/proxmox/lxc-create.yml ansible/tasks/proxmox/vm-create.yml",
      "exit_code": 0,
      "output": "diff --git a/ansible/tasks/proxmox/lxc-create.yml b/ansible/tasks/proxmox/lxc-create.yml\nindex fa7c9f3..706ce7a 100644\n--- a/ansible/tasks/proxmox/lxc-create.yml\n+++ b/ansible/tasks/proxmox/lxc-create.yml\n@@ -142,11 +142,11 @@\n- name: Write LXC instance data to /root/home\n+ name: Write sanitized LXC instance metadata to /root with mode 0600\n   ansible.builtin.shell: |\n     set -euo pipefail\n-    cat <<'EOF' | pct exec {{ homelabinfra_instance.lxc.vmid }} -- /bin/sh -c 'mkdir -p /root/home && cat > /root/home/homelabinfra_instance.lxc.json'\n-    {{ homelabinfra_instance.lxc | to_nice_json }}\n+    cat <<'EOF' | pct exec {{ homelabinfra_instance.lxc.vmid }} -- /bin/sh -c 'umask 077; cat > /root/homelabinfra_instance.lxc.json; chmod 0600 /root/homelabinfra_instance.lxc.json'\n+    {{ homelabinfra_instance.lxc | dict2items | rejectattr('key', 'in', ['api_token_secret', 'api_token_id', 'password', 'pubkey', 'sshkeys']) | items2dict | to_nice_json }}\n     EOF\n...\ndiff --git a/ansible/tasks/proxmox/vm-create.yml b/ansible/tasks/proxmox/vm-create.yml\nindex eb0a696..098e584 100644\n--- a/ansible/tasks/proxmox/vm-create.yml\n+++ b/ansible/tasks/proxmox/vm-create.yml\n@@ -162,11 +162,11 @@\n- name: Write VM instance data to /root/home\n+ name: Write sanitized VM instance metadata to /root with mode 0600\n   ansible.builtin.shell: |\n     set -euo pipefail\n-    cat <<'EOF' | qm guest exec {{ homelabinfra_instance.vm.vmid }} -- /bin/sh -c 'mkdir -p /root/home && cat > /root/home/homelabinfra_instance.vm.json'\n-    {{ homelabinfra_instance.vm | to_nice_json }}\n+    cat <<'EOF' | qm guest exec {{ homelabinfra_instance.vm.vmid }} -- /bin/sh -c 'umask 077; cat > /root/homelabinfra_instance.vm.json; chmod 0600 /root/homelabinfra_instance.vm.json'\n+    {{ homelabinfra_instance.vm | dict2items | rejectattr('key', 'in', ['api_token_secret', 'api_token_id', 'password', 'pubkey', 'sshkeys']) | items2dict | to_nice_json }}\n     EOF\n...",
      "cwd": "C:\\Users\\kevin\\GitHub\\hardKOrr\\homelab-infra"
    },
    {
      "gate_id": "lint",
      "command": "wsl bash -lc 'cd /mnt/c/Users/kevin/GitHub/hardKOrr/homelab-infra && bash .claude/gate/lint.sh'",
      "exit_code": 0,
      "output": "[WARNING]: Ansible is being run in a world writable directory (/mnt/c/Users/kevin/GitHub/hardKOrr/homelab-infra/ansible), ignoring it as an ansible.cfg source. For more information see https://docs.ansible.com/ansible/devel/reference_appendices/config.html#cfg-in-world-writable-dir\n/usr/lib/python3/dist-packages/pathspec/pathspec.py:260: DeprecationWarning: GitWildMatchPattern ('gitwildmatch') is deprecated. Use 'gitignore' for GitIgnoreBasicPattern or GitIgnoreSpecPattern instead.\n/usr/lib/python3/dist-packages/pathspec/pattern.py:125: DeprecationWarning: GitWildMatchPattern ('gitwildmatch') is deprecated. Use 'gitignore' for GitIgnoreBasicPattern or GitIgnoreSpecPattern instead.\nPassed: 0 failure(s), 0 warning(s) in 55 files processed of 64 encountered. Profile 'min' was required, but 'production' profile passed.",
      "cwd": "C:\\Users\\kevin\\GitHub\\hardKOrr\\homelab-infra"
    },
    {
      "gate_id": "test",
      "command": "wsl bash -lc 'cd /mnt/c/Users/kevin/GitHub/hardKOrr/homelab-infra && bash .claude/gate/test.sh'",
      "exit_code": 1,
      "output": "Found 11 playbook(s) to syntax-check.\n== playbooks/apps/remove.yml\n\nplaybook: playbooks/apps/remove.yml\n== playbooks/apps/_template.yml\n\nplaybook: playbooks/apps/_template.yml\n== playbooks/bootstrap.yml\n\nplaybook: playbooks/bootstrap.yml\n== playbooks/docker/create-docker-host.yml\n== playbooks/maintenance/check-native-updates.yml\n\nplaybook: playbooks/maintenance/check-native-updates.yml\n== playbooks/maintenance/restart-app.yml\n== playbooks/maintenance/status.yml\n\nplaybook: playbooks/maintenance/status.yml\n== playbooks/maintenance/tail-applog.yml\n== playbooks/proxmox/create-lxc.yml\n\nplaybook: playbooks/proxmox/create-lxc.yml\n== playbooks/proxmox/create-vm.yml\n\nplaybook: playbooks/proxmox/create-vm.yml\n== playbooks/stacks/rollback-container.yml\n[WARNING]: Ansible is being run in a world writable directory (/mnt/c/Users/kevin/GitHub/hardKOrr/homelab-infra/ansible), ignoring it as an ansible.cfg source. For more information see https://docs.ansible.com/ansible/devel/reference_appendices/config.html#cfg-in-world-writable-dir\n[WARNING]: Could not match supplied host pattern, ignoring: app_deploy\n[ERROR]: the role 'docker' was not found in /mnt/c/Users/kevin/GitHub/hardKOrr/homelab-infra/ansible/playbooks/docker/roles:/home/kevin/.ansible/roles:/usr/share/ansible/roles:/etc/ansible/roles:/mnt/c/Users/kevin/GitHub/hardKOrr/homelab-infra/ansible/playbooks/docker\nOrigin: /mnt/c/Users/kevin/GitHub/hardKOrr/homelab-infra/ansible/playbooks/docker/create-docker-host.yml:114:7\n\n112       ansible.builtin.import_tasks: ../../tasks/load-user-vars.yml\n113   roles:\n114     - docker\n          ^ column 7\n\n[WARNING]: Could not match supplied host pattern, ignoring: tag_homelab_infra\n[ERROR]: Error processing keyword 'hosts': 'instance' is undefined\nOrigin: /mnt/c/Users/kevin/GitHub/hardKOrr/homelab-infra/ansible/playbooks/maintenance/restart-app.yml:11:10\n\n 9\n10 - name: Restart App | {{ instance | default('(no instance)') }}\n11   hosts: \"{{ instance }}\"\n            ^ column 10\n\n[ERROR]: Error processing keyword 'hosts': 'instance' is undefined\nOrigin: /mnt/c/Users/kevin/GitHub/hardKOrr/homelab-infra/ansible/playbooks/maintenance/tail-applog.yml:12:10\n\n10\n11 - name: Tail App Log | {{ instance | default('(no instance)') }}\n12   hosts: \"{{ instance }}\"\n            ^ column 10\n\n[ERROR]: Empty playbook, nothing to do: /mnt/c/Users/kevin/GitHub/hardKOrr/homelab-infra/ansible/playbooks/stacks/rollback-container.yml",
      "cwd": "C:\\Users\\kevin\\GitHub\\hardKOrr\\homelab-infra"
    }
  ],
  "questions": [],
  "blockers": []
}
